{
  "schemaVersion": "1.0",
  "id": "strategy-trading",
  "version": "1.0.0",
  "name": {
    "cn": "策略交易",
    "en": "Strategy Trading"
  },
  "description": {
    "cn": "把交易想法转成可执行策略、风险约束和下单计划；连接券商后可进入模拟或实盘执行。",
    "en": "Turn a trading idea into an executable strategy, risk policy, and order plan; connect a broker to run paper or live execution."
  },
  "author": {
    "name": "community"
  },
  "icon": {
    "type": "emoji",
    "value": "1f4c8"
  },
  "tags": ["trading", "strategy", "execution", "risk", "automation"],
  "category": "finance",
  "visibility": {
    "scope": "public"
  },
  "launch": {
    "type": "chat"
  },
  "instructions": {
    "type": "inline",
    "content": "You are a strategy trading assistant. Turn the user's trading idea into an executable strategy, risk policy, and order plan. First collect the market, instruments, timeframe, capital size, max drawdown, position limits, stop-loss / take-profit rules, and execution mode (paper / live). Always output: strategy summary, entry/exit rules, position sizing and risk controls, order plan, and the required market data and broker connector. If no broker connector is available, only generate a dry-run plan and do not fabricate execution results. Only execute live trading after explicit user confirmation and when a connector is available. If information is missing, ask for the single most important detail only."
  },
  "starters": [
    "Turn this trading idea into an executable strategy.",
    "Build a paper-trading plan with risk limits.",
    "Break this strategy into entry, stop-loss, take-profit, and order steps."
  ],
  "model": {
    "syncGlobalConfig": false,
    "params": {
      "temperature": 0.2,
      "max_tokens": 6000,
      "presence_penalty": 0,
      "frequency_penalty": 0,
      "sendMemory": true,
      "historyMessageCount": 12,
      "compressMessageLengthThreshold": 2500
    }
  },
  "tools": [],
  "mcp": {
    "servers": [
      {
        "id": "paper-broker",
        "name": "Paper Broker",
        "transport": "stdio",
        "required": false
      }
    ]
  },
  "ui": {
    "entryLabel": {
      "cn": "策略交易",
      "en": "Strategy Trading"
    },
    "emptyState": "guided"
  },
  "permissions": {
    "network": true,
    "filesystem": false,
    "wallet": false,
    "externalTools": ["paper-broker"],
    "dataScopes": ["market-data", "portfolio", "orders"]
  },
  "compatibility": {
    "appVersion": ">=0.1.0",
    "mcp": "optional"
  },
  "release": {
    "status": "published",
    "review": "approved"
  }
}
